{
  "schema_version": "1.0",
  "dataset_version": "0.2.1",
  "license": "Apache-2.0",
  "copyright": "Copyright 2026 Mayank",
  "disclaimer": "Not legal or audit advice. Requirement text is a condensed paraphrase; verify against the authoritative source. CIA classifications, domain groupings and cross-framework mappings are expert judgement. Provided AS IS. Standards referenced remain the property of their publishers; see NOTICE and DISCLAIMER.md.",
  "domains": [
    {
      "id": "ai-system-societal-impact-assessment",
      "name": "AI System & Societal Impact Assessment",
      "description": "Assessing impact of an AI system on individuals, groups and society across its lifecycle.",
      "consolidation_guidance": "Run one AI System Impact Assessment (per ISO/IEC 42005) per AI system; its output satisfies ISO 42001 6.1.4/8.4, EU AI Act FRIA-adjacent needs, GDPR DPIA overlap, and NIST Map 5.",
      "control_ids": [
        "iso-42001:6.1.4",
        "iso-42001:8.4",
        "iso-42001:A.5.2",
        "iso-42001:A.5.3",
        "iso-42001:A.5.4",
        "iso-42001:A.5.5",
        "iso-42005:4",
        "iso-42005:5.1",
        "iso-42005:5.2",
        "iso-42005:5.3",
        "iso-42005:5.6",
        "iso-42005:5.7",
        "iso-42005:5.9",
        "iso-42005:5.10",
        "iso-42005:6.2",
        "iso-42005:6.4",
        "iso-42005:Annex-A",
        "iso-42005:Annex-C-D",
        "iso-42005:Annex-E",
        "eu-ai-act:Art.27",
        "gdpr:Art.35",
        "nist-ai-rmf:Map-5",
        "nist-aria:FT.2",
        "pbd:3.2"
      ]
    },
    {
      "id": "ai-system-classification-scope-categorization",
      "name": "AI System Classification, Scope & Categorization",
      "description": "Determining what an AI system is, its intended use, risk tier and applicability of each framework.",
      "consolidation_guidance": "Maintain one AI system inventory with fields for EU AI Act risk tier, ISO 42001/27001 scope and NIST categorization - classify once, reuse everywhere.",
      "control_ids": [
        "iso-42001:4.3",
        "iso-27001:4.3",
        "eu-ai-act:Art.6",
        "eu-ai-act:Art.7",
        "eu-ai-act:Annex-III",
        "nist-ai-rmf:Map-1",
        "nist-ai-rmf:Map-2",
        "nist-ai-rmf:Map-3",
        "nist-aria:P.1"
      ]
    },
    {
      "id": "access-control-identity-management",
      "name": "Access Control & Identity Management",
      "description": "Identity lifecycle, authentication, authorization, privileged access and segregation of duties.",
      "consolidation_guidance": "One IAM/PAM programme (incl. MFA and periodic access review) satisfies ISO 27001 5.15-5.18/8.2-8.5 and the access-control expectations referenced across AI and privacy frameworks.",
      "control_ids": [
        "iso-27001:A.5.3",
        "iso-27001:A.5.15",
        "iso-27001:A.5.16",
        "iso-27001:A.5.17",
        "iso-27001:A.5.18",
        "iso-27001:A.8.2",
        "iso-27001:A.8.3",
        "iso-27001:A.8.5",
        "iso-27001:A.8.18",
        "iso-42005:6.5",
        "gdpr:Art.29"
      ]
    },
    {
      "id": "asset-inventory-information-classification",
      "name": "Asset Inventory & Information Classification",
      "description": "Knowing what information/AI/data/tooling assets exist and classifying them.",
      "consolidation_guidance": "One asset and AI-resource inventory with a classification scheme underpins nearly every other domain - do this early, once, and reference it from all frameworks.",
      "control_ids": [
        "iso-42001:A.4.4",
        "iso-42001:A.4.5",
        "iso-42001:A.4.2",
        "iso-27001:A.5.9",
        "iso-27001:A.5.11",
        "iso-27001:A.5.12",
        "iso-27001:A.5.13",
        "dora:Art.8"
      ]
    },
    {
      "id": "business-continuity-resilience-availability",
      "name": "Business Continuity, Resilience & Availability",
      "description": "Maintaining availability of systems and services under disruption.",
      "consolidation_guidance": "One BCP/DR programme with tested RTO/RPO covers ISO 27001 5.29-5.30/8.6/8.13-8.14, DORA Art.11-12, and the availability expectations in EU AI Act Art.15 and GDPR Art.32.",
      "control_ids": [
        "iso-27001:A.5.29",
        "iso-27001:A.5.30",
        "iso-27001:A.8.6",
        "iso-27001:A.8.13",
        "iso-27001:A.8.14",
        "dora:Art.11",
        "dora:Art.12"
      ]
    },
    {
      "id": "cryptography-masking-data-loss-prevention",
      "name": "Cryptography, Masking & Data Loss Prevention",
      "description": "Encryption, key management, data masking, DLP and controlled deletion.",
      "consolidation_guidance": "One cryptography and data-protection standard (encryption at rest/in transit, masking rules, deletion schedule) covers ISO 27001 8.10-8.12/8.24, GDPR Art.32, and ISO 42001/27701 equivalents.",
      "control_ids": [
        "iso-27001:A.5.14",
        "iso-27001:A.8.10",
        "iso-27001:A.8.11",
        "iso-27001:A.8.12",
        "iso-27001:A.8.24",
        "iso-27701:6.T",
        "gdpr:Art.32",
        "pbd:3.3",
        "pbd:5.1",
        "pbd:5.2"
      ]
    },
    {
      "id": "data-governance-quality-provenance-ai-ml-data",
      "name": "Data Governance, Quality & Provenance (AI/ML data)",
      "description": "Managing training/validation/operational data: sourcing, quality, lineage and preparation.",
      "consolidation_guidance": "One data governance procedure with dataset documentation and lineage tracking covers ISO 42001 A.7.x, EU AI Act Art.10, and NIST Map/Measure data-related items.",
      "control_ids": [
        "iso-42001:A.7.4",
        "iso-42001:A.4.3",
        "iso-42001:A.7.2",
        "iso-42001:A.7.3",
        "iso-42001:A.7.6",
        "eu-ai-act:Art.10",
        "eu-ai-act:Art.53",
        "oecd-ai:3.3"
      ]
    },
    {
      "id": "data-provenance-lineage",
      "name": "Data Provenance & Lineage",
      "description": "Securely deriving and recording provenance metadata - chain of custody, transformations, actors - for data assets including AI training data and model lineage.",
      "consolidation_guidance": "Use the Data Governance Register (Tab 19) as the working log, following ISO/IEC 5181's secure-derivation techniques, to produce the provenance evidence that ISO 42001 A.7.5 and EU AI Act Art.10 require.",
      "control_ids": [
        "iso-42001:A.7.5",
        "iso-5181:ID",
        "iso-5181:Scope",
        "iso-5181:T.1",
        "iso-5181:T.2",
        "iso-5181:T.3",
        "iso-5181:T.4",
        "iso-5181:T.5",
        "iso-5181:T.6",
        "iso-5181:AI.1",
        "iso-5181:AI.2",
        "iso-5181:AI.3",
        "iso-5181:AI.4",
        "iso-5181:AI.5"
      ]
    },
    {
      "id": "data-subject-individual-rights-transparency",
      "name": "Data Subject / Individual Rights & Transparency",
      "description": "Providing information to and honouring the rights of individuals/PII principals/deployers.",
      "consolidation_guidance": "One rights-request handling process (access, rectification, erasure, objection, portability) plus one transparency-notice template covers GDPR Chapter III, EU AI Act Art.13/50, ISO 27701 7.3/8.3 and OECD 1.3.",
      "control_ids": [
        "iso-27701:7.3",
        "iso-27701:8.3",
        "iso-27701:Annex-A",
        "iso-31700:4.2",
        "iso-31700:5.2",
        "iso-31700:5.4",
        "iso-31700:5.5",
        "eu-ai-act:Art.13",
        "eu-ai-act:Art.50",
        "gdpr:Art.12-14",
        "gdpr:Art.15",
        "gdpr:Art.16",
        "gdpr:Art.17",
        "gdpr:Art.18",
        "gdpr:Art.19",
        "gdpr:Art.20",
        "gdpr:Art.21",
        "gdpr:Art.22",
        "gdpr:Art.34",
        "oecd-ai:1.3",
        "pbd:7.3"
      ]
    },
    {
      "id": "documentation-records-configuration-control",
      "name": "Documentation, Records & Configuration Control",
      "description": "Controlling documented information, technical documentation and configuration/records over time.",
      "consolidation_guidance": "One document-control and configuration-management system (versioning, approval workflow, retention) satisfies the documented-information clauses across every management-system framework in this workbook.",
      "control_ids": [
        "iso-42001:7.5.3",
        "iso-42001:7.5.1",
        "iso-42001:7.5.2",
        "iso-42001:A.6.2.3",
        "iso-42001:A.6.2.7",
        "iso-42001:A.8.2",
        "iso-27001:7.5.1",
        "iso-27001:7.5.2",
        "iso-27001:7.5.3",
        "iso-27001:A.5.33",
        "iso-27001:A.5.37",
        "iso-27001:A.8.9",
        "iso-42005:6.1",
        "iso-42005:6.3",
        "iso-31700:4.9",
        "iso-17021-1:10.2.3",
        "iso-17021-1:10.2.4",
        "eu-ai-act:Art.11",
        "eu-ai-act:Art.18",
        "eu-ai-act:Annex-IV",
        "gdpr:Art.30"
      ]
    },
    {
      "id": "framework-specific-no-direct-cross-framework-equivalent",
      "name": "Framework-Specific (no direct cross-framework equivalent)",
      "description": "Items unique to one framework with no meaningful equivalent elsewhere in this workbook (e.g. EU AI Act prohibited practices/scope, OECD broad policy recommendations, ISO 17021 certification-body-only clauses, standard-identification/status rows).",
      "consolidation_guidance": "No consolidation possible - address individually per framework; do not expect another control to cover these.",
      "control_ids": [
        "iso-27701:Annex-C-E",
        "iso-27090:ID",
        "iso-27090:Scope",
        "iso-31700:TR-2",
        "iso-17021-1:4.1",
        "iso-17021-1:4.2",
        "iso-17021-1:4.4",
        "iso-17021-1:4.5",
        "iso-17021-1:4.6",
        "iso-17021-1:4.8",
        "iso-17021-1:7.3",
        "iso-17021-1:8.3",
        "iso-17021-1:8.5",
        "iso-17021-1:10.1",
        "iso-17021-1:10.2.1",
        "iso-17021-1:10.2.2",
        "iso-17021-1:10.3",
        "eu-ai-act:Art.2",
        "eu-ai-act:Art.3",
        "eu-ai-act:Art.5",